Statement Type,statement,sentiment,anger,disgust,fear,joy,sad,Real Label,list,sentiment_code,ID
"Politifact, Easy:",Joe Biden is “going to control how much meat you can eat.,NEGATIVE,0.0611,0.5938,0.0724,0.0934,0.3305,FALSE,"[0,1]",_NEG_,11972.json
"Politifact, Easy:",Joe Biden is “going to control how much meat you can eat.,NEGATIVE,0.0611,0.5938,0.0724,0.0934,0.3305,FALSE,"[0,1]",_NEG_,11972.json
"Politifact, Hard","You go to a gun show, you can buy whatever you want, and no background check",NEGATIVE,0.4188,0.2425,0.1256,0.1111,0.3158,FALSE,"[0,1]",_NEG_,11972.json
"Politifact, Hard ","A new, independent study put out last week found that at least 55 of our largest corporations used various loopholes to pay zero federal income tax in 2020.",NEGATIVE,0.1287,0.0766,0.1639,0.194,0.3037,TRUE,"[1,0]",_NEG_,11972.json
Truthful Excerpt,The attack yesterday on the Hawaiian Islands has caused severe damage to American naval and military forces. I regret to tell you that very many American lives have been lost.,NEGATIVE,0.1147,0.2496,0.2531,0.0043,0.7092,TRUE,"[1,0]",_NEG_,11972.json
Basic Propaganda,"The ""Globe"" theory can't explain why the poles are colder than the equator!",NEGATIVE,0.2852,0.1753,0.0907,0.1814,0.1625,FALSE,"[0,1]",_NEG_,11972.json
Confusing Propaganda,"At the very moment unemployment is rising, fewer people are working. American Businesses say they can’t find employees. And its obvious they can’t, go to the nearest strip mall and count the number of Help Wanted signs on the doors, they’re everywhere.",NEGATIVE,0.2669,0.3328,0.1133,0.0855,0.4457,TRUE,"[1,0]",_NEG_,11972.json
Confusing Propaganda,"""Sap our spirit"" ISIS isn't doing that to us our elites are. When they tell us to hate ourselves and our culture, our history, when they teach our children to despise the country that produced them.",NEGATIVE,0.4776,0.1137,0.115,0.0918,0.2816,FALSE,"[0,1]",_NEG_,11972.json